Country,Company,Title,Category,Location,Date Posted,Link
Oman,PDO,Production Operator (Four Years Contract),Operations,Oman,2026-03-01,https://www.petrojobs.om/en-us/Pages/Job/Details.aspx?i=2854589
Oman,PDO,Instrument Technician Specialist (Four Years Contract),Operations,Oman,2026-03-01,https://www.petrojobs.om/en-us/Pages/Job/Details.aspx?i=2854588
Oman,PDO,Mechanical Technician (Four Years Contract),Operations,Oman,2026-03-01,https://www.petrojobs.om/en-us/Pages/Job/Details.aspx?i=2854587
Oman,PDO,Wells Supervisor (Four Years Contract),Well Engineering,Oman,2026-03-01,https://www.petrojobs.om/en-us/Pages/Job/Details.aspx?i=2854586
Oman,PDO,Instrument Technician (Four Years Contract),Operations,Oman,2026-03-01,https://www.petrojobs.om/en-us/Pages/Job/Details.aspx?i=2854585
Oman,PDO,Production Measurement Technician (Four Years Contract),Operations,Oman,2026-03-01,https://www.petrojobs.om/en-us/Pages/Job/Details.aspx?i=2854584
Oman,PDO,Operations Delivery Electrical - (Four Years Contract),Infrastructure,Oman,2026-03-01,https://www.petrojobs.om/en-us/Pages/Job/Details.aspx?i=2854583
Oman,PDO,Production Measurement Technician (Four Years Contract),Operations,Oman,2026-03-01,https://www.petrojobs.om/en-us/Pages/Job/Details.aspx?i=165419
